{
  "$schema": "https://json-schema.org/draft/2020-12/schema",
  "$id": "https://github.com/usdimpact/usd-impact-pipeline/blob/main/research/score_v2_predictive_implementation_contract.schema.json",
  "title": "USD Impact Score v2 predictive implementation contract",
  "type": "object",
  "additionalProperties": false,
  "required": [
    "$schema",
    "contract_id",
    "contract_version",
    "registered_date",
    "research_only",
    "production_change",
    "trading_strategy_claim",
    "locked_preregistration_commit_sha",
    "locked_preregistration_file_sha256",
    "study_grid",
    "weekly_source",
    "weekly_record",
    "target",
    "primary_endpoint",
    "secondary_endpoints",
    "reporting",
    "failure_policy"
  ],
  "properties": {
    "$schema": {"const": "./score_v2_predictive_implementation_contract.schema.json"},
    "contract_id": {"const": "usd_impact_score_v2_predictive_implementation_2026-08-25"},
    "contract_version": {"const": 1},
    "registered_date": {"const": "2026-08-25"},
    "research_only": {"const": true},
    "production_change": {"const": false},
    "trading_strategy_claim": {"const": false},
    "locked_preregistration_commit_sha": {"const": "89bf56bafd594987176f31efaa926ecf02228289"},
    "locked_preregistration_file_sha256": {"const": "36accc42e4915bb48caa1c4d2fd0fac8ba27c51c0eb988916990c415830e3ca0"},
    "study_grid": {"type": "object"},
    "weekly_source": {"type": "object"},
    "weekly_record": {"type": "object"},
    "target": {"type": "object"},
    "primary_endpoint": {"type": "object"},
    "secondary_endpoints": {"type": "object"},
    "reporting": {"type": "object"},
    "failure_policy": {"type": "object"}
  }
}
